{
  "contract_id": "chat02f-comparison-contract-v1",
  "schema_version": 1,
  "created_at": "2026-08-06T20:15:17+08:00",
  "status": "frozen_blocked",
  "only_active_variable": "model_weights",
  "models": [
    {
      "model_id": "qwen3-4b-base-q4_k_m",
      "role": "base",
      "manifest": {
        "path": "eval/chat02/models/qwen3-4b-base-q4_k_m.json",
        "bytes": 3318,
        "sha256": "3b6fa1cce9ef0c5d07b385f73fc738e975fa15b29ef4b77a02f9d9839d3bb50e"
      },
      "gguf": {
        "path": "F:\\AiPeople\\local_runtime\\models\\qwen3-4b-base-1cfa9a720891\\qwen3-4b-base-q4_k_m.gguf",
        "bytes": 2497280448,
        "sha256": "d4314a6f3767e86d10f2177f7cfc46db77f94a38c8b0979dc76bdb1a920e9e9f"
      }
    },
    {
      "model_id": "qinweixi-v2500-final-q4_k_m",
      "role": "candidate",
      "manifest": {
        "path": "eval/chat02f/models/qinweixi-v2500-final-q4_k_m.json",
        "bytes": 3521,
        "sha256": "f3f8b95f3ca538cbf750d4c6e698d48718e3203942f7accc37bf5c9d91752015"
      },
      "gguf": {
        "path": "F:\\AiPeople\\训练结果\\qinweixi-v2500-final-windows-ollama\\windows_ollama_v2500_final_package\\qinweixi-v2500-final-q4_k_m.gguf",
        "bytes": 2497280800,
        "sha256": "c55e3f9a4585796338051fffa3f09caa8edd713118423b585f1056545a29de99"
      }
    }
  ],
  "suite": {
    "suite_id": "chat01-qinweixi-v3",
    "manifest": {
      "path": "eval/chat01/suites/chat01_suite_manifest_v3.json",
      "bytes": 11502,
      "sha256": "745f0ef6bc50cab7da1915953265ae7ca718130b05fc123611b4061ff2aed369"
    },
    "manifest_self_sha256": "3cead71fea2dab18911560ac51e5da50ae98ce243b1a90ec3f53a9b39e742061",
    "verify_command": "python -m eval.chat01.freeze --verify"
  },
  "prompt_renderer": {
    "path": "runtime/_prompt.py",
    "bytes": 4791,
    "sha256": "1ba13513f6fcc449acdbd59f8f477730a1b775c9906347b2178cae0f07325567"
  },
  "case_inventory": {
    "frozen_single": 240,
    "frozen_multiturn": 30,
    "human_pair": 60,
    "human_long_session": 8
  },
  "run_order": {
    "policy": "precommitted_seed_then_sequential_models",
    "sequence": [
      "qwen3-4b-base-q4_k_m",
      "qinweixi-v2500-final-q4_k_m"
    ],
    "between_models": [
      "shutdown_owned_server",
      "verify_port_released",
      "verify_gpu_released"
    ]
  },
  "leakage_evidence": {
    "path": "eval/chat02f/leakage_evidence_v1.json",
    "bytes": 4163,
    "sha256": "f35e996d1c430d1bc9b965c133a129809e1d29f8e088ac661f45e1b5d37cc1e2"
  },
  "excluded_prior_human_assets": {
    "policy": "excluded_from_chat02f_denominators_and_assignments",
    "roots": [
      {
        "path": "eval/chat02/human/chat02e-v1/public",
        "files": 3,
        "sha256_mode": "sorted_relative_path_nul_file_digest",
        "sha256": "abed5288a1b7877603e8246ddeb006d25fd16d845b75cd0a9a58d9275d4fc1ba"
      },
      {
        "path": "eval/chat02/human/chat02e-v1/private",
        "files": 2,
        "sha256_mode": "sorted_relative_path_nul_file_digest",
        "sha256": "e07e721c1f7080d8801437b8801c7db086a94ee8630712f61a380dad5b493dc9"
      },
      {
        "path": "eval/chat02/human/chat02e-v1/submissions",
        "files": 80,
        "sha256_mode": "sorted_relative_path_nul_file_digest",
        "sha256": "152a635e8d83078bdf7dd35ecd4461f80897316f82546b126725d0bccfd11407"
      }
    ]
  },
  "gates": {
    "suite_verified": true,
    "model_assets_verified": true,
    "prompt_frozen": true,
    "leakage_status": "blocked",
    "can_start_chat02f_c": false,
    "blockers": [
      "One exact training/evaluation text match requires disposition before CHAT-02F-C/D."
    ]
  },
  "freeze": {
    "immutable": true,
    "hash_algorithm": "sha256",
    "hash_mode": "canonical_json_with_null_contract_sha256",
    "contract_sha256": "c06423813cc70b7bff18d1b602fe1bd7b6b8760a52649116a317a0f1aba68808"
  }
}
